{
  "project_id": "example-project",
  "project_profile_revision": "example-project-profile-v2",
  "task_version": "2.0",
  "task_id": "EX-990-T001",
  "run_id": "RUN-FIXTURE-EX-0001",
  "step_id": "coordinate",
  "depends_on": [],
  "assigned_role": "growth-coordinator",
  "role_contract": {
    "artifact_ref": "agents/roles/core/growth-coordinator.json",
    "artifact_revision": "growth-agent-registry-v1",
    "artifact_sha256": "84dcf07a394b086f4c928b3e70771374b37af5e83be4bad33fb292c80850af8e"
  },
  "route_id": "research-evidence",
  "route_contract": {
    "artifact_ref": "agents/routes/research-evidence.json",
    "artifact_revision": "growth-agent-registry-v1",
    "artifact_sha256": "c20c8413b8365f7b27908ac5261da7aedb557b27f6e94303312cf3f5e3f6a303"
  },
  "objective": "Frame one bounded evidence question and its stop rule.",
  "project_context": {
    "artifact_ref": "context/manifests/CTX-EXAMPLE-0001.fixture-r1.json",
    "artifact_revision": "fixture-r1",
    "artifact_sha256": "17c3d329142e64d02ce9a9e41958d2f2edde9c9b086002e221f76a88379e9b25"
  },
  "input_artifacts": [
    {
      "artifact_ref": "context/sections/facts/facts-fixture-r1.json",
      "artifact_revision": "facts-fixture-r1",
      "artifact_sha256": "4c5c41626516b6ec7fa9b877210077eaac18cdf06b06e8748b08f91362537134"
    }
  ],
  "output_contract": "result-envelope@2",
  "authority": {
    "allowed_write_roots": ["handoffs", "records/decisions"],
    "external_side_effects": false,
    "may_publish": false
  },
  "created_at": "2026-09-01T01:01:00Z"
}
